{
  "schema_version": 1,
  "match_id": "csn_vex_production_smoke_match",
  "seed": 42045,
  "first_player": 0,
  "initial_draw_count": 6,
  "definition_bundle_digest": "8ee7e358c940121a115629b59c4a185216b9a3595ff8ac4510599640c9f73558",
  "players": [
    {
      "player_id": 0,
      "hero_definition_id": "crash_in_smoke_hero_attacker",
      "ordered_deck": [
        "crash_in_smoke_filler", "crash_in_smoke_filler", "crash_in_smoke_filler",
        "crash_in_smoke_filler", "crash_in_smoke_filler", "crash_in_smoke_filler",
        "crash_in_smoke_filler", "crash_in_smoke_filler", "crash_in_smoke_filler",
        "crash_in_smoke_filler"
      ]
    },
    {
      "player_id": 1,
      "hero_definition_id": "crash_in_smoke_hero_csn",
      "ordered_deck": [
        "char_csn_vex", "crash_in_smoke_filler", "crash_in_smoke_filler",
        "crash_in_smoke_filler", "crash_in_smoke_filler", "crash_in_smoke_filler",
        "crash_in_smoke_filler", "crash_in_smoke_filler", "crash_in_smoke_filler",
        "crash_in_smoke_filler"
      ]
    }
  ],
  "markers": [
    { "player_id": 0, "type": "trap", "tile": { "x": 0, "y": 8 }, "definition_id": "crash_in_smoke_trap", "placement_order": 0 },
    { "player_id": 0, "type": "trap", "tile": { "x": 1, "y": 8 }, "definition_id": "crash_in_smoke_trap", "placement_order": 1 },
    { "player_id": 0, "type": "npc", "tile": { "x": 0, "y": 7 }, "definition_id": "crash_in_smoke_npc", "placement_order": 2 },
    { "player_id": 0, "type": "npc", "tile": { "x": 1, "y": 7 }, "definition_id": "crash_in_smoke_npc", "placement_order": 3 },
    { "player_id": 1, "type": "trap", "tile": { "x": 0, "y": 0 }, "definition_id": "crash_in_smoke_trap", "placement_order": 4 },
    { "player_id": 1, "type": "trap", "tile": { "x": 1, "y": 0 }, "definition_id": "crash_in_smoke_trap", "placement_order": 5 },
    { "player_id": 1, "type": "npc", "tile": { "x": 0, "y": 1 }, "definition_id": "crash_in_smoke_npc", "placement_order": 6 },
    { "player_id": 1, "type": "npc", "tile": { "x": 1, "y": 1 }, "definition_id": "crash_in_smoke_npc", "placement_order": 7 }
  ]
}
