{
  "schema_version": 1,
  "match_id": "after_damage_trigger_smoke_match",
  "seed": 920413,
  "first_player": 0,
  "initial_draw_count": 6,
  "definition_bundle_digest": "0f4daf68ba16b91e6431458b87b0d24202631ff77f7e1da17df57205f49b4b4c",
  "players": [
    {
      "player_id": 0,
      "hero_definition_id": "after_damage_fixture_hero_alpha",
      "ordered_deck": [
        "after_damage_fixture_filler", "after_damage_fixture_filler",
        "after_damage_fixture_filler", "after_damage_fixture_filler",
        "after_damage_fixture_filler", "after_damage_fixture_filler",
        "after_damage_fixture_filler", "after_damage_fixture_filler",
        "after_damage_fixture_filler", "after_damage_fixture_filler"
      ]
    },
    {
      "player_id": 1,
      "hero_definition_id": "after_damage_fixture_hero_beta",
      "ordered_deck": [
        "after_damage_fixture_filler", "after_damage_fixture_filler",
        "after_damage_fixture_filler", "after_damage_fixture_filler",
        "after_damage_fixture_filler", "after_damage_fixture_filler",
        "after_damage_fixture_filler", "after_damage_fixture_filler",
        "after_damage_fixture_filler", "after_damage_fixture_filler"
      ]
    }
  ],
  "markers": [
    { "player_id": 0, "type": "trap", "tile": { "x": 0, "y": 8 }, "definition_id": "after_damage_fixture_trap", "placement_order": 0 },
    { "player_id": 0, "type": "trap", "tile": { "x": 1, "y": 8 }, "definition_id": "after_damage_fixture_trap", "placement_order": 1 },
    { "player_id": 0, "type": "npc", "tile": { "x": 0, "y": 7 }, "definition_id": "after_damage_fixture_npc", "placement_order": 2 },
    { "player_id": 0, "type": "npc", "tile": { "x": 1, "y": 7 }, "definition_id": "after_damage_fixture_npc", "placement_order": 3 },
    { "player_id": 1, "type": "trap", "tile": { "x": 0, "y": 0 }, "definition_id": "after_damage_fixture_trap", "placement_order": 4 },
    { "player_id": 1, "type": "trap", "tile": { "x": 1, "y": 0 }, "definition_id": "after_damage_fixture_trap", "placement_order": 5 },
    { "player_id": 1, "type": "npc", "tile": { "x": 0, "y": 1 }, "definition_id": "after_damage_fixture_npc", "placement_order": 6 },
    { "player_id": 1, "type": "npc", "tile": { "x": 1, "y": 1 }, "definition_id": "after_damage_fixture_npc", "placement_order": 7 }
  ]
}
