{
  "schema_version": 1,
  "match_id": "pending_attack_redirect_smoke_match",
  "seed": 41027,
  "first_player": 0,
  "initial_draw_count": 6,
  "definition_bundle_digest": "a0a52a3fca402b38b506d270c5ce502e4940de023700c49055d4271a357be0dd",
  "players": [
    {
      "player_id": 0,
      "hero_definition_id": "redirect_fixture_hero_a",
      "ordered_deck": [
        "redirect_fixture_attacker",
        "redirect_fixture_filler", "redirect_fixture_filler", "redirect_fixture_filler",
        "redirect_fixture_filler", "redirect_fixture_filler", "redirect_fixture_filler",
        "redirect_fixture_filler", "redirect_fixture_filler", "redirect_fixture_filler"
      ]
    },
    {
      "player_id": 1,
      "hero_definition_id": "redirect_fixture_hero_b",
      "ordered_deck": [
        "redirect_fixture_filler", "redirect_fixture_filler", "redirect_fixture_filler",
        "redirect_fixture_filler", "redirect_fixture_filler", "redirect_fixture_filler",
        "redirect_fixture_filler", "redirect_fixture_filler", "redirect_fixture_filler",
        "redirect_fixture_filler"
      ]
    }
  ],
  "markers": [
    { "player_id": 0, "type": "trap", "tile": { "x": 0, "y": 8 }, "definition_id": "redirect_fixture_trap", "placement_order": 0 },
    { "player_id": 0, "type": "trap", "tile": { "x": 1, "y": 8 }, "definition_id": "redirect_fixture_trap", "placement_order": 1 },
    { "player_id": 0, "type": "npc", "tile": { "x": 0, "y": 7 }, "definition_id": "redirect_fixture_npc", "placement_order": 2 },
    { "player_id": 0, "type": "npc", "tile": { "x": 1, "y": 7 }, "definition_id": "redirect_fixture_npc", "placement_order": 3 },
    { "player_id": 1, "type": "trap", "tile": { "x": 0, "y": 0 }, "definition_id": "redirect_fixture_trap", "placement_order": 4 },
    { "player_id": 1, "type": "trap", "tile": { "x": 1, "y": 0 }, "definition_id": "redirect_fixture_trap", "placement_order": 5 },
    { "player_id": 1, "type": "npc", "tile": { "x": 0, "y": 1 }, "definition_id": "redirect_fixture_npc", "placement_order": 6 },
    { "player_id": 1, "type": "npc", "tile": { "x": 1, "y": 1 }, "definition_id": "redirect_fixture_npc", "placement_order": 7 }
  ]
}
