{
  "schema_version": 1,
  "match_id": "csn_body_double_smoke_match",
  "seed": 42031,
  "first_player": 0,
  "initial_draw_count": 6,
  "definition_bundle_digest": "90d2691b93affd7add3cfb6ec4732debc56ba3ae1ce83d85405aab6ef35f9ecf",
  "players": [
    {
      "player_id": 0,
      "hero_definition_id": "body_double_fixture_hero_a",
      "ordered_deck": [
        "body_double_fixture_attacker",
        "body_double_fixture_filler", "body_double_fixture_filler", "body_double_fixture_filler",
        "body_double_fixture_filler", "body_double_fixture_filler", "body_double_fixture_filler",
        "body_double_fixture_filler", "body_double_fixture_filler", "body_double_fixture_filler"
      ]
    },
    {
      "player_id": 1,
      "hero_definition_id": "body_double_fixture_hero_b",
      "ordered_deck": [
        "body_double_fixture_csn",
        "effect_react_csn_body_double",
        "body_double_fixture_filler", "body_double_fixture_filler", "body_double_fixture_filler",
        "body_double_fixture_filler", "body_double_fixture_filler", "body_double_fixture_filler",
        "body_double_fixture_filler", "body_double_fixture_filler"
      ]
    }
  ],
  "markers": [
    { "player_id": 0, "type": "trap", "tile": { "x": 0, "y": 8 }, "definition_id": "body_double_fixture_trap", "placement_order": 0 },
    { "player_id": 0, "type": "trap", "tile": { "x": 1, "y": 8 }, "definition_id": "body_double_fixture_trap", "placement_order": 1 },
    { "player_id": 0, "type": "npc", "tile": { "x": 0, "y": 7 }, "definition_id": "body_double_fixture_npc", "placement_order": 2 },
    { "player_id": 0, "type": "npc", "tile": { "x": 1, "y": 7 }, "definition_id": "body_double_fixture_npc", "placement_order": 3 },
    { "player_id": 1, "type": "trap", "tile": { "x": 0, "y": 0 }, "definition_id": "body_double_fixture_trap", "placement_order": 4 },
    { "player_id": 1, "type": "trap", "tile": { "x": 1, "y": 0 }, "definition_id": "body_double_fixture_trap", "placement_order": 5 },
    { "player_id": 1, "type": "npc", "tile": { "x": 0, "y": 1 }, "definition_id": "body_double_fixture_npc", "placement_order": 6 },
    { "player_id": 1, "type": "npc", "tile": { "x": 1, "y": 1 }, "definition_id": "body_double_fixture_npc", "placement_order": 7 }
  ]
}
