{
  "schema_version": 1,
  "match_id": "csn_undertow_archivist_production_smoke_match",
  "seed": 42042,
  "first_player": 0,
  "initial_draw_count": 6,
  "definition_bundle_digest": "0d7ffbe33ae79ee590e0b0eb66d37a02482906f6b6c5b7218b067e293a14d2e5",
  "players": [
    {
      "player_id": 0,
      "hero_definition_id": "crash_in_smoke_hero_attacker",
      "ordered_deck": [
        "crash_in_smoke_negate_b", "crash_in_smoke_filler", "crash_in_smoke_filler",
        "crash_in_smoke_filler", "crash_in_smoke_filler", "crash_in_smoke_filler",
        "crash_in_smoke_filler", "crash_in_smoke_filler", "crash_in_smoke_filler",
        "crash_in_smoke_filler"
      ]
    },
    {
      "player_id": 1,
      "hero_definition_id": "crash_in_smoke_hero_csn",
      "ordered_deck": [
        "char_csn_rook", "char_csn_undertow_archivist", "wand_equip_switch",
        "effect_react_csn_crash_in", "crash_in_smoke_negate_c", "crash_in_smoke_filler",
        "undertow_smoke_private_draw", "crash_in_smoke_filler", "crash_in_smoke_filler",
        "crash_in_smoke_filler"
      ]
    }
  ],
  "markers": [
    { "player_id": 0, "type": "trap", "tile": { "x": 0, "y": 8 }, "definition_id": "crash_in_smoke_trap", "placement_order": 0 },
    { "player_id": 0, "type": "trap", "tile": { "x": 1, "y": 8 }, "definition_id": "crash_in_smoke_trap", "placement_order": 1 },
    { "player_id": 0, "type": "npc", "tile": { "x": 0, "y": 7 }, "definition_id": "crash_in_smoke_npc", "placement_order": 2 },
    { "player_id": 0, "type": "npc", "tile": { "x": 1, "y": 7 }, "definition_id": "crash_in_smoke_npc", "placement_order": 3 },
    { "player_id": 1, "type": "trap", "tile": { "x": 0, "y": 0 }, "definition_id": "crash_in_smoke_trap", "placement_order": 4 },
    { "player_id": 1, "type": "trap", "tile": { "x": 1, "y": 0 }, "definition_id": "crash_in_smoke_trap", "placement_order": 5 },
    { "player_id": 1, "type": "npc", "tile": { "x": 0, "y": 1 }, "definition_id": "crash_in_smoke_npc", "placement_order": 6 },
    { "player_id": 1, "type": "npc", "tile": { "x": 1, "y": 1 }, "definition_id": "crash_in_smoke_npc", "placement_order": 7 }
  ]
}
