{
  "schema_version": 1,
  "match_id": "csn_rook_production_smoke_match",
  "seed": 42043,
  "first_player": 0,
  "initial_draw_count": 6,
  "definition_bundle_digest": "152a869dd25a7d1d7e839ff9e2aec47ebbca31d164f42bc567bd19f6324a7c73",
  "players": [
    {
      "player_id": 0,
      "hero_definition_id": "crash_in_smoke_hero_attacker",
      "ordered_deck": [
        "crash_in_smoke_filler", "crash_in_smoke_filler", "crash_in_smoke_filler",
        "crash_in_smoke_filler", "crash_in_smoke_filler", "crash_in_smoke_filler",
        "crash_in_smoke_filler", "crash_in_smoke_filler", "crash_in_smoke_filler",
        "crash_in_smoke_filler"
      ]
    },
    {
      "player_id": 1,
      "hero_definition_id": "crash_in_smoke_hero_csn",
      "ordered_deck": [
        "char_csn_rook", "wand_equip_switch", "crash_in_smoke_filler",
        "crash_in_smoke_filler", "crash_in_smoke_filler", "crash_in_smoke_filler",
        "crash_in_smoke_filler", "crash_in_smoke_filler",
        "crash_in_smoke_filler", "crash_in_smoke_filler",
        "char_csn_undertow_archivist", "undertow_smoke_private_draw",
        "crash_in_smoke_filler", "crash_in_smoke_filler"
      ]
    }
  ],
  "markers": [
    { "player_id": 0, "type": "trap", "tile": { "x": 0, "y": 8 }, "definition_id": "crash_in_smoke_trap", "placement_order": 0 },
    { "player_id": 0, "type": "trap", "tile": { "x": 1, "y": 8 }, "definition_id": "crash_in_smoke_trap", "placement_order": 1 },
    { "player_id": 0, "type": "npc", "tile": { "x": 0, "y": 7 }, "definition_id": "crash_in_smoke_npc", "placement_order": 2 },
    { "player_id": 0, "type": "npc", "tile": { "x": 1, "y": 7 }, "definition_id": "crash_in_smoke_npc", "placement_order": 3 },
    { "player_id": 1, "type": "trap", "tile": { "x": 0, "y": 0 }, "definition_id": "crash_in_smoke_trap", "placement_order": 4 },
    { "player_id": 1, "type": "trap", "tile": { "x": 1, "y": 0 }, "definition_id": "crash_in_smoke_trap", "placement_order": 5 },
    { "player_id": 1, "type": "npc", "tile": { "x": 0, "y": 1 }, "definition_id": "crash_in_smoke_npc", "placement_order": 6 },
    { "player_id": 1, "type": "npc", "tile": { "x": 1, "y": 1 }, "definition_id": "crash_in_smoke_npc", "placement_order": 7 }
  ]
}
